{
  "queryId": "query-aoi-0002",
  "worldId": "world-srv-arena-01",
  "context": { "contextId": "wctx-srv-01", "generation": 4 },
  "consistency": "ExplicitRevision",
  "requestedWorldRevision": 12,
  "boundWorldRevision": 12,
  "points": [
    { "x": -1, "y": 64, "z": 5 }
  ],
  "limits": { "maxResults": 64, "maxBatchBytes": 65536, "deadlineTick": 60 },
  "status": "Failed",
  "chunkStatuses": [
    { "chunkId": "c:-1:0:0", "presence": "Unavailable" }
  ],
  "terminalError": "TargetRevisionUnavailable"
}
